{
  "schema": "athyper.compiled-entity-artifact/2.0-draft",
  "schemaVersion": 2,
  "contractStatus": "draft_for_review",
  "artifactType": "flow",
  "artifactKey": "business_partner/flow.intake",
  "entityCode": "business_partner",
  "plane": "neon",
  "flowKey": "business_partner_intake",
  "flowKind": "flow_selector",
  "draftEntityCode": "business_partner_request",
  "flowRefs": [
    "business_partner_request/flow.customer.add.json",
    "business_partner_request/flow.customer.company.json",
    "business_partner_request/flow.customer.credit.json",
    "business_partner_request/flow.customer.new.json",
    "business_partner_request/flow.partner.amend.json",
    "business_partner_request/flow.partner.archive.json",
    "business_partner_request/flow.partner.assign.json",
    "business_partner_request/flow.partner.deactivate.json",
    "business_partner_request/flow.partner.reactivate.json",
    "business_partner_request/flow.supplier.activate.json",
    "business_partner_request/flow.supplier.add.json",
    "business_partner_request/flow.supplier.bank.json",
    "business_partner_request/flow.supplier.company.json",
    "business_partner_request/flow.supplier.new.json",
    "business_partner_request/flow.supplier.qualify.json",
    "business_partner_request/flow.workforce.add.json",
    "business_partner_request/flow.workforce.change.json",
    "business_partner_request/flow.workforce.new.json",
    "business_partner_request/flow.workforce.offboard.json"
  ],
  "selection": "authorized_request_kind_and_source",
  "dependencies": [
    "business_partner/core",
    "business_partner_request/flow.customer.add",
    "business_partner_request/flow.customer.company",
    "business_partner_request/flow.customer.credit",
    "business_partner_request/flow.customer.new",
    "business_partner_request/flow.partner.amend",
    "business_partner_request/flow.partner.archive",
    "business_partner_request/flow.partner.assign",
    "business_partner_request/flow.partner.deactivate",
    "business_partner_request/flow.partner.reactivate",
    "business_partner_request/flow.supplier.activate",
    "business_partner_request/flow.supplier.add",
    "business_partner_request/flow.supplier.bank",
    "business_partner_request/flow.supplier.company",
    "business_partner_request/flow.supplier.new",
    "business_partner_request/flow.supplier.qualify",
    "business_partner_request/flow.workforce.add",
    "business_partner_request/flow.workforce.change",
    "business_partner_request/flow.workforce.new",
    "business_partner_request/flow.workforce.offboard",
    "business_partner_request/operation"
  ],
  "artifactHash": "sha256:6ed94cc8c9324382583088b6c49b65104aff06064135c559c2973a08d9e30fcd"
}
